{"$schema":"https://json-schema.org/draft/2020-12/schema","$id":"https://haihao0307.github.io/guilin-dem-pipeline/schemas/dem-procedural-landscape/project-binding-v2.schema.json","title":"DEM Procedural Landscape Project Binding v2","type":"object","additionalProperties":true,"required":["schemaVersion","documentType","project","skill","activeBranches","truthSources","constraints","stages","release"],"properties":{"schemaVersion":{"const":"2.0.0"},"documentType":{"const":"dem-procedural-landscape-project-binding"},"project":{"type":"object","required":["id","nameZh","city","status"],"properties":{"id":{"type":"string","minLength":1},"nameZh":{"type":"string","minLength":1},"city":{"type":"string","minLength":1},"status":{"enum":["reference","data-blocked","implementation","data-qa","browser-qa","visual-review","approved","published","rolled-back"]}}},"skill":{"type":"object","required":["id","version","ref","registryPath"],"properties":{"id":{"const":"dem-procedural-landscape"},"version":{"const":"0.2.0"},"ref":{"const":"skill/dem-procedural-landscape-v010"},"registryPath":{"const":"skills/dem-procedural-landscape/BRANCH_REGISTRY.json"}}},"activeBranches":{"type":"array","minItems":1,"items":{"type":"object","required":["id","role","skillPath","status"],"properties":{"id":{"type":"string","minLength":1},"role":{"type":"string","minLength":1},"skillPath":{"type":"string","minLength":1},"status":{"enum":["reference","contract","blocked","implementation","qa","approved"]}}}},"truthSources":{"type":"array","minItems":1,"items":{"type":"object","required":["id","projectId","kind","status","immutable","nativeSurveyClaim"],"properties":{"id":{"type":"string","minLength":1},"projectId":{"type":"string","minLength":1},"kind":{"enum":["dem","bathymetry","hydrology","historical-vector","proxy-terrain","reference-image","other"]},"status":{"enum":["authoritative","verified","historically-reconstructed","reviewed-manual-repair","proxy","unverified","unknown","planned","blocked"]},"path":{"type":"string"},"sha256":{"type":"string","pattern":"^[a-f0-9]{64}$"},"crs":{"type":"string"},"resolutionMeters":{"type":["number","null"],"exclusiveMinimum":0},"outputGridMeters":{"type":["number","null"],"exclusiveMinimum":0},"immutable":{"const":true},"nativeSurveyClaim":{"const":false}}}},"constraints":{"type":"object","required":["no30mFinalFallback","noSyntheticGapFill","noTruthOverwrite","verticalScale","projectDataIsolation"],"properties":{"no30mFinalFallback":{"const":true},"noSyntheticGapFill":{"const":true},"noTruthOverwrite":{"const":true},"verticalScale":{"const":"1:1"},"projectDataIsolation":{"const":true}}},"historicalOutput":{"type":"object","required":["enabled","native1mSurveyClaim"],"properties":{"enabled":{"type":"boolean"},"targetEpoch":{"type":["string","null"]},"defaultDetailedCoreKm2":{"type":["number","null"],"exclusiveMinimum":0},"targetOutputGridMeters":{"type":["number","null"],"exclusiveMinimum":0},"label":{"type":["string","null"]},"native1mSurveyClaim":{"const":false}}},"stages":{"type":"array","minItems":1,"items":{"type":"object","required":["id","status"],"properties":{"id":{"type":"string","minLength":1},"status":{"enum":["planned","contract","blocked","implementation","data-qa","browser-qa","visual-review","approved","published","rolled-back"]},"evidence":{"type":"array","items":{"type":"string"}},"blockers":{"type":"array","items":{"type":"string"}}}}},"release":{"type":"object","required":["status","draftOnly","browserQaRequired","rollbackRequired","controllerVisualApprovalRequired","publicReleaseApproved"],"properties":{"status":{"enum":["planned","contract","blocked","implementation","data-qa","browser-qa","visual-review","approved","published","rolled-back"]},"draftOnly":{"type":"boolean"},"browserQaRequired":{"const":true},"rollbackRequired":{"const":true},"controllerVisualApprovalRequired":{"const":true},"publicReleaseApproved":{"type":"boolean"}}}}}
