{"schemaVersion":"2.0.0","documentType":"dem-procedural-landscape-project-binding","project":{"id":"guilin-yangtang","nameZh":"桂林秧塘程序化地貌参考项目","city":"Guilin","status":"reference"},"skill":{"id":"dem-procedural-landscape","version":"0.2.0","ref":"skill/dem-procedural-landscape-v010","registryPath":"skills/dem-procedural-landscape/BRANCH_REGISTRY.json"},"activeBranches":[{"id":"guilin-10km2-detail","role":"reference-implementation","skillPath":"skills/dem-procedural-landscape/branches/guilin-10km2-detail/SKILL.md","status":"reference"},{"id":"terrain-geomorphology","role":"method-contract","skillPath":"skills/dem-procedural-landscape/branches/terrain-geomorphology/SKILL.md","status":"contract"},{"id":"water-system","role":"inland-interface-reference","skillPath":"skills/dem-procedural-landscape/branches/water-system/SKILL.md","status":"contract"},{"id":"ecology-agriculture","role":"reference-implementation","skillPath":"skills/dem-procedural-landscape/branches/ecology-agriculture/SKILL.md","status":"reference"},{"id":"historical-reconstruction","role":"future-historical-core","skillPath":"skills/dem-procedural-landscape/branches/historical-reconstruction/SKILL.md","status":"blocked"},{"id":"runtime-publication","role":"reference-and-future-unified-runtime","skillPath":"skills/dem-procedural-landscape/branches/runtime-publication/SKILL.md","status":"contract"}],"truthSources":[{"id":"guilin-yangtang-v031-proxy-terrain","projectId":"guilin-yangtang","kind":"proxy-terrain","status":"proxy","path":"DEM-Map-Pipeline/guilin-zhenbaoding-yangshuo-pingle/metadata/ecology/v0.3.1/ecology-release-manifest.json","crs":"EPSG:32649","resolutionMeters":null,"outputGridMeters":null,"immutable":true,"nativeSurveyClaim":false,"notes":"确定性生态验证代理，只保留方法和视觉回归，等待真实 12.5 m DEM。"},{"id":"guilin-real-12p5m-dem","projectId":"guilin-yangtang","kind":"dem","status":"blocked","path":"","crs":"EPSG:32649","resolutionMeters":null,"outputGridMeters":12.5,"immutable":true,"nativeSurveyClaim":false,"notes":"真实栅格尚未挂载到该参考实现。"}],"constraints":{"no30mFinalFallback":true,"noSyntheticGapFill":true,"noTruthOverwrite":true,"verticalScale":"1:1","projectDataIsolation":true},"historicalOutput":{"enabled":true,"targetEpoch":"1940-1945","defaultDetailedCoreKm2":48.0,"referenceFixtureKm2":10.0,"targetOutputGridMeters":1.0,"label":"1米历史增强地形","native1mSurveyClaim":false},"stages":[{"id":"skill-contract","status":"contract","evidence":["skills/dem-procedural-landscape/SKILL.md"]},{"id":"v031-reference-method","status":"approved","evidence":["10.0 km² reference","68 erosion streamlines","permanent-channel terrestrial vegetation 0"]},{"id":"real-12p5m-dem","status":"blocked","blockers":["exact real 12.5 m raster not mounted"]},{"id":"historical-core","status":"blocked","blockers":["real DEM and historical source package required"]},{"id":"unified-runtime","status":"planned","blockers":["foundation validator and browser runtime pending"]}],"release":{"status":"contract","draftOnly":true,"browserQaRequired":true,"rollbackRequired":true,"controllerVisualApprovalRequired":true,"publicReleaseApproved":false}}
